song_title,lyrics
I Want My Baby Back,"I'm working day and night to find me my passage to write
I'm gonna get the next train, going to be right by her side
Ooh-ah Kitty, just you see
Don't put the blame on me, oh no

I want my baby back, oh no
I want my baby back

I tried to phone her, but the cable was broke by a storm
Now I won't see her till tomorrow, when night meets the dawn
Ooh-ah Kitty, just you see
Don't put the blame on me, oh no

I want my baby back, oh no
I want my baby back

I'll buy her anything
A big fat car, a diamond ring
If she will be my girl
I want her back, I need you girl

I'm working day and night to find me my passage to write
I'm gonna get the next train, going to be right by her side
Ooh-ah Kitty, just you see
Don't put the blame on me, oh no

I want my baby back, oh no
I want my baby back, oh no"
Bars of the County Jail,"La la la la la la la la (etc.)

Gather you all and listen here
I'll tell you a tale if you lend me an ear
I rode a horse through many a town
But the devil rode me down to the ground
I was to marry a very rich girl
I loved her as only I can
But the father was shot and his gold was stoled
And now I'm the devil's man, na na na
And now I sing a tale of woe
Through the bars of the county jail, na la la la la la la la la la

La la la la la la la la (etc.)

I walked into the room one night
I found her mother and gun
Well, the man was dead and I kneeled and cried
The sheriff ran in and said ""I'm holding you, son""

La la la la la la la la (etc.)

Through the day I sing and play
For time is on my side
But when the moon and stars come out
I lay me down and cry
For the Saviour, mar I lied
Now I will not have a ride
Beside the window the scaffold was made
On the morrow I will hang...

La la la la la la la la (etc.)"
Baby Loves That Way ( Davy Jones  and The Lower Third) ,"(Baby loves that way)
Yes, she does, yes, she does
(Baby loves that way)
Oh, I love my baby
(Baby loves that way)
Ooh, I gotta take her
(Baby loves that way)
Yep, I love her

Baby likes to go outside, so I let her
Wants to fool with other guys, so I let her
Wants to be bad, so I let her be bad
But fooling around, it will make me sad
She fools around with other boys and treat me like an unwanted toy

(Baby loves that way)
Oh, I love my baby
(Baby loves that way)
Ooh, she does too much to me
(Baby loves that way)
And I can't think too much of her
(Baby loves that way)
Gotta take her, gotta take her

Gonna better leave her alone, put you down son
Treating her real fine, thus I'm home being a loner
Jeanny's my babe and that's alright, yeah
She treats me good, each and every night
She fools around with other boys and treat me like an unwanted toy

(Baby loves that way)
I love my baby
(Baby loves that way)
Ooh, she's too much
(Baby loves that way)
Yes she does, yes she does
(Baby loves that way)

(Baby loves that way)
I love my baby
(Baby loves that way)
Yeah, she's too much, yeah yeah
(Baby loves that way)
Ooh, I think she can live with me
(Baby loves that way)
Love her, love her, love her

Baby likes to go outside, so I let her
Wants to fool with other guys, so I let her
Wants to be bad, so I let her be bad
But fooling around, it will make me sad
She clings around with all the boys, who treat her like unwanted toys

(Baby loves that way)
Obviously this is the end
(Baby loves that way)
Gotta take her
(Baby loves that way)
Ooh yeah
(Baby loves that way)
Can't do enough
(Baby loves that way"
The London Boys,"Bow Bells strike another night
Your eyes are heavy and your limbs all ache
You've bought some coffee, butter and bread
You can't make a thing cause the meter's dead
You moved away
Told your folks you're gonna stay away

Bright lights, Soho, Wardour street
You hope you make friends with the guys that you meet
Somebody shows you round
Now you've met the London boys
Things seem good again, someone cares about you

Oh, the first time that you tried a pill
You feel a little queasy, decidedly ill
You're gonna be sick, but you mustn't lose faith
To let yourself down would be a big disgrace
With the London boys, with the London boys

You're only seventeen, but you think you've grown
In the month you've been away from your parents' home
You take the pills too much
You don't give a damn about that jobs you've got
So long as you're with the London boys

A London boy, oh a London boy
Your flashy clothes are your pride and joy
A London boy, a London boy
You think you've had a lot of fun
But you ain't got nothing, you're on the run
It's too late now, 'cause you're out there boy
You've got it made with the rest of the toys
Now you wish you'd never left your home
You've got what you wanted but you're on your own
With the London boys

Now you've met the London boys
Now you've met the London boys
Now you've met the London boys"
I Dig Everything,"I've got the village I love
I walk along beside the garbagemen and I dig everything
I wave to the policemen, but they don't wave back
They don't dig anything
Ain't had a job for a year or more and I don't know a thing
Everything's spent and I dig everything
Everything's spent and I dig everything
Dig

I feed the lions in Trafalgar Square and I dig everything
I've sit just behind my window, till my cigarettes were low and dug
Everything
Got a backstreet room in the bad part of town and I dig everything
I'd see people in the street below, who don't know where they're going
They don't dig anything
Everything's spent and I dig everything
Everything's spent and I dig everything
Dig

I've got more friends than I've had hot dinners
Some of them were losers, but the rest of them are winners
Rick, John, Sally, a connection named Paul
Holy low on money, their intentions are tall
We smoke and talk in my room and we dig everything
Dig

I've made myself at home
I've made good friends which the time-check girl on the end of the phone
All the movie shows
I sunbathe for love
Even when it's not too hot
'Cause I dig everything
Oh yeah"
I'm Not Losing Sleep,"Yes, I've read the morning papers
Telling me that you've made money
Do you think I'm gonna crawl, then think again

Though I'm dressed in rags, I'm richer
Though I eat from tins, I'm healthier
Though I live in slums, I'm purer than you, my friend

Too bad, I'm not losing sleep
(Too bad) I'm just counting sheep
(Too bad) I'm not losing sleep, my friend

Look around and see the friends
The ones you left, our friends deserted
See the guys that used to talk and drink with you

Don't look down your nose at me
'Cause I won't ask your sympathy
I won't be your yes-sir man for anything

Too bad, I'm not losing sleep
(Too bad) I'm just counting sheep
(Too bad) I'm not losing sleep, my friend

I would walk with you
Talk with you, drink with you
If you drop that halo that you're wearing on the ground

Too bad, I'm not losing sleep
(Too bad) I'm just counting sheep
(Too bad) I'm not losing sleep, my friend

I can't get my satisfaction
Knowing you won't get reaction
What makes me the big attraction anyway

It's too bad, I'm not losing sleep
(Too bad) I'm just counting sheep
(Too bad) I'm not losing sleep, my friend

Too bad, I'm not losing sleep
(Too bad) I'm just counting sheep
(Too bad) I'm not losing sleep, my friend

Oh, it's too bad, I'm not losing sleep
(Too bad) I'm just counting sheep
(Too bad) I'm not losing sleep, my friend"
Rubber Band,"Rubber Band
There's a rubber band that plays tunes out of tune
In the library garden Sunday afternoon
While a little chappie waves a golden wand

Rubber Band
In 1910, I was so handsome and so strong
My moustache was stiffly waxed and one foot long
And I loved a girl while you played teatime tunes

Dear Rubber Band, you're playing my tune out of tune, oh

Rubber Band
Won't you play your haunting theme again to me?
While I eat my scones and drink my cup of tea
The sun is warm but it's a lonely afternoon

Oh, play that theme

Rubber Band
How I wish that I could join your Rubber Band
We could play in library parks throughout the land
And one Sunday afternoon, I'd find my love

Rubber Band
In the '14-'18 war I went to sea
Thought my Sunday love was waiting home for me
And now she's married to the leader of the band, oh

spoken:
Oh sob, I hope you break your baton"
Cant Help Thinking About Me(David Bowie with The Lower Third) ,"Question time
That says I brought dishonour
My head's bowed in shame
It seems that I've blackened the family name

Mother says
That she can't stand the neighbours' talking
I've gotta pack my bags
Leave this home, start walking, yeah

I'm guilty
I wish that I was sorry this time
I wish that I could pay for my crime

I can't help thinking about me
I can't help thinking about me
I can't help thinking about me

Remember when
We used to go to church on Sundays
I lay awake at night
Terrified of school on Mondays

Oh, but it's too late now
I wish I was a child again
I wish I felt secure again

I can't help thinking about me
I can't help thinking about me
I can't help thinking about me

As I pass a recreation ground
I remember my friends always be found
And I can't

I can't help thinking about me
I can't help thinking about me
I can't help thinking about me

Now I leave them all
In the Never-Never Land
The station seems so cold
The ticket's in my hand

My girl calls my name,
""Hi Dave.
Drop in, see you around, come back
If you're this way again.""

Oh, I'm on my own
I've got a long, long way to go
I hope I make it on my own

I can't help thinking about me
I can't help thinking about me
I can't help thinking about me
I can't help thinking about me
I can't help thinking about me"
Do Anything You Say,"Two by two, they go walking by
Hand in hand, they watch me cry
(Two by two, hand in hand)

Lonely nights, I dream you're there
Morning sun and you're gone
(Lonely nights, morning sun)

(Maybe) I'll do anything you say
(Maybe) I'll do anything you say
(Maybe) I'll do anything you say
Do anything you say, do anything

One desire I ask of you
Please be mine, please be mine
(One desire, please be mine)

Thousand years and I'll return
You'll be mine, you'll be mine
(Thousand years, you'll be mine)

(Maybe) I'll do anything you say
(Maybe) I'll do anything you say
(Maybe) I'll do anything you say
Do anything you say, do anything

Two by two they're walking by
Hand in hand, they watch me cry
(Two by two, hand in hand)

(Maybe) I'll do anything you say
(Maybe) I'll do anything you say
(Maybe) I'll do anything you say
Do anything you say, do anything

(Maybe) I'll do anything you say
(Maybe) I'll do anything you say
(Maybe) I'll do anything you say
Do anything you say, do anything you say"
Good Morning Girl,"Unfortunately, we are not licensed to display the full lyrics for this song at the moment. Hopefully we will be able to in the future. Until then... how about a random page?"
And I Say to Myself(David Bowie with The Lower Third) ,"And I say to myself
I've got it wrong, wrong, wrong
She is a play-girl
She the wrong wrong girl for me
And I say to myself
You're a fool, fool, fool
She doesn't love you
She doesn't need you, this I know

She's got a trail of men that she takes
Wherever she goes
She hasn't the strength to love any single man for a length of time

(And I say to myself)
Ooh, I don't stand a chance
(And I say to myself)
It's a long long romance
(And I say to myself)
Well, she's out to slay
(And I say to myself)
Well, she's got it made
(And I say to myself)
Oh yeah, oh yeah
(And I say to myself)
Oh yeah

And I say to myself that she shouldn't love anybody else in the world but me
And I say to myself
Forget her now, now, now
She don't want you
She don't love you anymore
And I say to myself you're a fool, fool, fool
She's don't love you
She don't need you, this I know

And I turn around and look at myself
You'll never get her, you're a fool
Say after me I'm a fool- I'm a fool

(And I say to myself)
I can't get what I want
(And I say to myself)
And it makes me sad
(And I say to myself)
I can't get what I want
(And I say to myself)
And it makes me mad
(And I say to myself)
Oh yeah, oh yeah
(And I say to myself)
Oh yeah

And I say to myself that she shouldn't love anybody else in the world but me,
Yeah
Yeah

(And I say to myself)
Oh, I feel so sad
(And I say to myself)
She's making me mad
(And I say to myself)
And I say to myself
(And I say to myself)
That I love her
(And I say to myself)
And I say to myself that I need her
(And I say to myself)
Oh, I need her

And I say to myself I'm a fool
And I say to myself"
Come and Buy My Toys,"Smiling girls and rosy boys 
Come and buy my little toys 
Monkeys made of gingerbread 
And sugar horses painted red 

Rich men's children running past 
Their fathers dressed in hose 
Golden hair and mud of many acres on their shoes 
Gazing eyes and running wild 
Past the stocks and over stiles 
Kiss the window merry child 
But come and buy my toys 

You've watched your father plough the fields with a ram's horn 
Sowed it wide with peppercorn and furrowed with a bramble thorn 
Reaped it with a sharpened scyth, threashed it with a quill 
The miller told your father that he'd work it with the greatest will 
Now your watching's over you must play with girls and boys 
Leave the parsley on the stalls 
Come and buy my toys 

You shall own a cambric shirt 
You shall work your father's land 
But now you shall play in the market square 
Till you'll be a man 

Smiling girls and rosy boys 
Come and buy my little toys 
Monkeys made of gingerbread 
And sugar horses painted red"
Maid of Bond Street,"This girl is made of lipstick 
Powder and paint 
Sees the pictures of herself 
Every magazine on every shelf 

This girl is maid of Bond Street 
Hailing cabs, lunches with executives 
Gleaming teeth sip aperitifs 

This girl is a lonely girl 
Takes the train from Paddington to Oxford Circus 
Buys the Daily News 
But passengers don't smile at her, don't smile at her 

This girl is made of loneliness 
A broken heart 
For the boy that she once knew 
Doesn't want to know her any more 

And this girl is a lonely girl 
Every thing she wants is hers 
But she can't make it with the boy she really wants to be with 
All the time, to love, all the time 

This boy is made of envy 
Jealousy 
He doesn't have a limousine 
Really wants to be a star himself 

This girl, her world is made of flashlights and films 
Her cares are scraps on the cutting room floor 

And maids of Bond Street drive round in chauffered cars 
Maids of Bond Street picture clothes, eyes of stars 
Maids of Bond Street shouldn't have worldly cares 
Maids of Bond Street shouldn't have love affairs"
Please Mr. Gravedigger,"There's a little churchyard just along the way
It used to be Lambeth's finest array
Of tombstones, epitaphs, wreaths, flowers all that jazz
Till the war came along and someone dropped a bomb on the lot

And in this little yard, there's a little old man
With a little shovel in his little bitty hand
He seems to spend all his days puffing fags and digging graves
He hates the reverend vicar and he lives all alone in his home

""Ah-choo, excuse me""

Please Mr. Gravedigger, don't feel ashamed
As you dig little holes for the dead and the maimed
Please Mr. Gravedigger, I couldn't care
If you found a golden locket full of some girl's hair
And you put it in your pocket

""God, it's pouring down""

Her mother doesn't know about your sentimental joy
She thinks it's down below with the rest of her toys
And Ma wouldn't understand, so I won't tell
So keep your golden locket all safely hid away in your pocket

Yes, Mr. GD, you see me every day
Standing in the same spot by a certain grave
Mary-Ann was only 10, full of life and oh so gay
And I was the wicked man who took her life away
Very selfish, Oh God

No, Mr. GD, you won't tell
And just to make sure that you keep it to yourself
I've started digging holes my friend
And this one here's for you

""Lifted our girl, she apparently doesn't know of it
Hello misses, thought she'd be a little girl
Bloody obscene, catch pneumonia or something in this rain"""
Sell Me a Coat,"La la la la la la
La la la la la la la

A winter's day, a bitter snowflake on my face 
My summer girl takes little backward steps away 
Jack Frost took her hand and left me
Jack Frost ain't so cool 

Sell me a coat with buttons of silver 
Sell me a coat that's red or gold 
Sell me a coat with little patch pockets 
Sell me a coat 'cause I feel cold 

And when she smiles, the ice forgets to melt away 
Not like before, her smile was warming yesterday 
See the trees like silver candy, feel my icy hand 

Sell me a coat with buttons of silver 
Sell me a coat that's red or gold 
Sell me a coat with little patch pockets 
Sell me a coat 'cause I feel cold 

See my eyes, my window pane 
See my tears like gentle rain 
That's the memory of a summer day 

Sell me a coat with buttons of silver 
Sell me a coat that's red or gold 
Sell me a coat with little patch pockets 
Sell me a coat 'cause I feel cold 

Sell me a coat with buttons of silver 
Sell me a coat that's red or gold 
Sell me a coat with little patch pockets 
Sell me a coat 'cause I feel cold 

La la la la la la (repeat)"
Did You Ever Have a Dream,"Did you ever have a dream or two
Where the hero is a guy named you
And the things he does are just too much
Does he fly like Mr. Superman, speak Chinese, French and Dutch?
And did you ever have a dream or two?

Have you ever woken up one day
With the feeling that you'd been away?
If the girl that you dreamed of last night
Had the same dream, in the very same scene
With the very same boy, hold tight

It's a very special knowledge that you've got, my friend
You can travel anywhere with anyone you care
It's a very special knowledge that you've got, my friend
You can walk around in New York while you sleep in Penge

I will travel round the world one night
On the magic wings of astral flight
If you've got the secret, tell me do
Have you ever had a dream or two?
Have you ever had a dream or two?"
Little Bombardier,"War made him a soldier 
Little Frankie Mear 
Peace left him a loser 
The little bombardier 

Lines of worry appeared with age 
Unskilled hands that knew no trade 
Spent his time in the picture house 
The little bombardier 

Frankie drank his money 
The little that he made 
Told his woes to no man 
Friendless, lonely days 

Then one day, in the ABC 
Four bright eyes gazed longingly 
At the ice-cream in the hand of 
The little bombardier 

Sunshine entered our Frankie's days 
Gone his worries, his hopeless maze 
His life was fun and his heart was full of joy 

Two young children had changed his aims 
He gave them toffees and played their games 
He brought them presents with every coin he made 

Then two gentlemen called on him 
Asked him for his name 
Why was he friends with the children 
Were they just a game? 

Leave them alone or we'll get sore 
We've had blokes like you in the station before 
The hand of authority said ""no more"" to 
The little bombardier 

Packed his bags, his heart in pain 
Wiped a tear and caught a train 
Not to be seen in the town again 
The little bombardier"
Let Me Sleep Beside You,"Baby, baby, brush the dust of youth from off your shoulder,
Because the years of threading daisies lie behind you now.
Don't return to fields of green where rainbow secrets were told.
Place your ragged doll with all the toys and paints and beads.
I will show you games where the winner never wins.

Let your hair hang down.
Wear the dress your mother wore.
Let me sleep beside you.

Lock away your childhood and throw away the key,
For now the streets and city sounds will burn your eyes as coals.
We shall drink the oldest wine, and velvet skies will linger.
Child, you're a woman now, your heart and soul are free.
I will hold a lighted lamp, and we shall walk together.

Let your hair hang down.
Wear the dress your mother wore.
Let me sleep beside you.

Your darkened eyes throw mystery,
But your lips are void of history.
You could not imagine that it could happen this way, could you?

I will give you dreams,
And I'll tell you things you'd like to hear.

Let your hair hang down.
Wear the dress your mother wore.
Let me sleep beside you.

Let me sleep beside you."
The Laughing Gnome ,"I was walking down the high street,
When I heard footsteps behind me.
And there was a little old man (Hello!)
In scarlet and gray, chuckling away

Well he trotted back to my house
And he sat beside the telly (Ah!)
With his tiny hands on his tummy
Chuckling away, laughing all day

""I ought to report you to the Gnome Office.""
""Gnome Office? Ahahahah!""

Ha, ha, ha, hee, hee, hee
I'm a laughing gnome and you can't catch me
Ha, ha, ha, hee, hee, hee
I'm a laughing gnome and you can't catch me,
Said the laughing gnome

Well I gave him roasted toadstools,
And a glass of dandelion wine. (*burp* Pardon...)
Then I put him on a train to Eastbourne.
Carried his bag, and gave him a fag.

""Have you got a light, boy?""
""Here, where do you come from?""
""Gnome-man's land, heehee!""
""Oh, really?""

In the morning, when I woke up,
He was sitting on the edge of my bed,
With his brother, whose name was Fred.
He'd brought him along to sing me a song.

""All right, let's hear it... 'ere, what's that clicking noise?""
""That's Fred, he's a metro-gnome, haha!""

Ha, ha, ha, hee, hee, hee
I'm a laughing gnome and you can't catch me
Ha, ha, ha, hee, hee, hee
I'm a laughing gnome and you can't catch me

""Oh now, I'm a gnome, anyway, haha!""
""Haven't you got a home to go to?""
""No, we are gnome-ads, hehe!""
""Didn't they teach you to get your hair cut at school? You look like a rolling gnome.""
""Nah, not at the London school of Eco-gnome-ics.""

Now they're staying up me chimney,
And we're living on caviar and honey (Hurray!)
'Cause they're earning me lots of money
Writing comedy prose for radio shows

""It's the, errrr... it's the gnome-service, yes, of course!""

Ha, ha, ha, hee, hee, hee
I'm a laughing gnome and you can't catch me
Ha, ha, ha, hee, hee, hee
(Oh, dear me...)
I'm a laughing gnome and you can't catch me
(One more time!)
Ha, ha, ha, hee, hee, hee
I'm a laughing gnome and you can't catch me"
Karma Man,"Fingertips sun at sideshow stalls, they throw the balls
At coconut furs that hide behind coloured shades that blind your eyes
Every child's mother holds an ice cream cone, they circle round
Perceived unknown by an eye that peers from a hole in a tent where no one goes
A figure sitting cross-legged on the floor 
He's cloaked and clothed in saffran robes, his beads are all he owns

Slow down, slow down
Someone must have said let's slow him down
Slow down, slow down
It's pictured on the arms of the karma man

Fairy tale skin depicting scenes from human zoos
Impermanent toys like peace and war, a gentle face you've seen before
Karma man tattooed on your side, the wheel of life
I see my times and who I've been, I only live now and I don't know why
I struggle hard to take these pictures in, but
All my friends can see is just the pinkness of his skin

Slow down, slow down
Someone must have said let's slow him down
Slow down, slow down
It's pictured on the arms of the karma man"
Join the Gang,"Let me introduce you to the gang
Johnny plays the sitar, he's an existentialist
Once he had a name, now he plays our game
You won't feel so good now that you've joined the gang

Molly is the model in the ads
Crazy clothes and acid full of soul and crazy hip
Someone switched her on, then her beam went wrong
'Cause she can't switch off now that she's joined the gang

Arthur is a singer with a band
Arthur drinks two bottles just before he goes on stage
Look at Arthur rave, all the kids are paid
They want to see the croaking man who joined the gang

You won't be alone, we've all got beery grins
It's a big illusion but at least you're in
At least you're in

This club's called The Webb, it's this month's pick
Next month we shall find a place where prices aren't so stiff
15 bob a coke, 'fraid that's past a joke
This is how to spend now that you've joined the gang

This is what to do now that you're here
Sit round doing nothing all together very fast
Psychedelic stars, throwing down cigars
They're picking up the joints now that they've joined the gang"
Love You till Tuesday,"Just look through your window, look who sits outside
Little me is waiting, standing through the night
When you walk out through your door, I'll wave my flag and shout

Oh, beautiful baby
My burning desire started on Sunday
Give me your heart and I'll love you till Tuesday

Who's that hiding in the apple tree, clinging to a branch
Don't be afraid, it's only me, hoping for a little romance
If you lie beneath my shade, I'll keep you nice and cool

Oh, beautiful baby
I was very lonely till I met you on Sunday
My passion's never-ending and I'll love you till Tuesday

Let the wind blow through your hair, be nice to the big blue sea
Don't be afraid of the man in the moon, because it's only me
I shall always want you until my love runs dry

Oh, beautiful baby
My heart's aflame, I'll love you till Tuesday
My head's in a whirl and I'll love you till Tuesday
Love, love, love, love you till Tuesday
Love, love, love, love you till Tuesday

Well, I might be able to stretch it till Wednesday"
Silly Boy Blue,"Mountains of Lhasa are feeling the rain
People are walking the Potala lanes
Preacher takes the school
One boy breaks a rule

Silly Boy Blue, blue
Silly Boy Blue

Yak butter statues that melt in the sun
Cannot dissolve all the work you've not done
A chela likes to feel
That his overself pays the bill

Silly Boy Blue, Blue
Silly Boy Blue

You wish and wish, and wish again
You've tried so hard to fly
You'll never leave your body now
You've got to wait to die

La la la la la, la la, la la la la
La la la la la, la la, la la la la
La la la, la la 
La la la, la la 
Silly Boy Blue, blue
Silly Boy Blue

Child of Tibet, you're a gift from the sun
Reincarnation of one better man
The homeward road is long
You've left your prayers and song

Silly Boy Blue, blue
Silly Boy Blue
Silly Boy Blue 
Silly Boy Blue"
